Date,Title,Url
"Jan 30, 2018",Pocket-size device decodes human genome with 99.88% accuracy,https://www.japantimes.co.jp/news/2018/01/30/business/tech/pocket-size-device-decodes-human-genome-99-88-accuracy/
"Jan 30, 2018","Russian bots retweeted Trump's Twitter 470,000 times ahead of 2016 election",https://www.japantimes.co.jp/news/2018/01/30/business/tech/russian-bots-retweeted-trumps-twitter-470000-times-ahead-2016-election/
"Jan 29, 2018",Trump security team considering a government-built 5G network to counter China,https://www.japantimes.co.jp/news/2018/01/29/business/tech/trump-security-team-considering-government-built-5g-network-counter-china/
"Jan 26, 2018","With self-parking slippers, Nissan drives hospitality to a new level",https://www.japantimes.co.jp/news/2018/01/26/business/tech/self-parking-slippers-nissan-drives-hospitality-new-level/
"Jan 25, 2018","Chinese tech firms narrowing pay gap with Silicon Valley as state pours money into IT, surveillance",https://www.japantimes.co.jp/news/2018/01/25/business/tech/chinese-tech-firms-narrowing-pay-gap-silicon-valley-state-pours-money-surveillance/
"Jan 25, 2018",Plug wars: leading the charge in the battle for electric car supremacy,https://www.japantimes.co.jp/news/2018/01/25/business/tech/plug-wars-leading-charge-battle-electric-car-supremacy/
"Jan 25, 2018",Driver following GPS plunges into Vermont lake,https://www.japantimes.co.jp/news/2018/01/25/business/tech/driver-following-gps-plunges-vermont-lake/
"Jan 25, 2018","I haz wins: Grumpy Cat's owner gets $710,000 court payout",https://www.japantimes.co.jp/news/2018/01/25/business/tech/haz-wins-grumpy-cats-owner-gets-710000-court-payout/
"Jan 24, 2018",Post-holiday gamble: Apple debuts HomePod voice speaker to take on Google and Amazon,https://www.japantimes.co.jp/news/2018/01/24/business/tech/post-holiday-gamble-apple-debuts-homepod-voice-speaker-take-google-amazon/
"Jan 23, 2018","Facebook acknowledges social media's risks to democracy, struggling to curb hate speech",https://www.japantimes.co.jp/news/2018/01/23/business/tech/facebook-acknowledges-social-medias-risks-democracy-struggling-curb-hate-speech/
"Jan 20, 2018",Facebook to let users rank 'trust' in news sources,https://www.japantimes.co.jp/news/2018/01/20/business/tech/facebook-let-users-rank-trust-news-sources/
"Jan 19, 2018",Researchers uncover vast spying operation using infected messaging apps,https://www.japantimes.co.jp/news/2018/01/19/business/tech/researchers-uncover-vast-spying-operation-using-infected-messaging-apps/
"Jan 18, 2018",Twitter may notify users exposed to Russian propaganda during 2016 election,https://www.japantimes.co.jp/news/2018/01/18/business/tech/twitter-may-notify-users-exposed-russian-propaganda-2016-election/
"Jan 15, 2018",AI-based story-summarizing system to debut at Japanese newspaper,https://www.japantimes.co.jp/news/2018/01/15/business/tech/ai-based-story-summarizing-system-debut-nagano-daily/
"Jan 12, 2018",Robots take baby steps toward emotion and empathy at CES,https://www.japantimes.co.jp/news/2018/01/12/business/tech/robots-take-baby-steps-toward-emotion-empathy-ces/
"Jan 11, 2018","After 12-year wait, Sony relaunches robot dog Aibo to much fanfare",https://www.japantimes.co.jp/news/2018/01/11/business/tech/12-year-wait-sony-relaunches-robot-dog-aibo-much-fanfare/
"Jan 11, 2018","Before autonomous car hits mainstream, test hop the self-driving suitcase",https://www.japantimes.co.jp/news/2018/01/11/business/tech/autonomous-car-hits-mainstream-test-hop-self-driving-suitcase/
"Jan 10, 2018",Amazon's Alexa voice assistant coming to Toyota's cars in 2018,https://www.japantimes.co.jp/news/2018/01/10/business/tech/amazons-alexa-voice-assistant-coming-toyotas-cars-2018/
"Jan 10, 2018",IBM breaks patent record with 25th straight year in top spot,https://www.japantimes.co.jp/news/2018/01/10/business/tech/ibm-breaks-patent-record-25th-straight-year-top-spot/
"Jan 10, 2018",Microsoft says security patches slowing PCs and servers; Intel shares dip,https://www.japantimes.co.jp/news/2018/01/10/business/tech/microsoft-says-security-patches-slowing-pcs-servers-intel-shares-dip/
"Jan 9, 2018",Apple urged to help curb smartphone addiction among children,https://www.japantimes.co.jp/news/2018/01/09/business/tech/two-key-investors-urge-apple-take-action-curb-child-gadget-addiction/
"Jan 9, 2018",Google teams with Sony and Lenovo for smart speakers with touchscreens,https://www.japantimes.co.jp/news/2018/01/09/business/tech/google-teams-sony-lenovo-smart-speakers-touchscreens/
"Jan 6, 2018",Businesses cautious in installing patches to fix chip flaw,https://www.japantimes.co.jp/news/2018/01/06/business/tech/businesses-cautious-installing-patches-fix-chip-flaw/
"Jan 6, 2018",Twitter says world leaders like Trump have special status,https://www.japantimes.co.jp/news/2018/01/06/business/tech/twitter-says-world-leaders-like-trump-special-status/
"Jan 5, 2018",Apple to issue fix for iPhones and Macs at risk from 'Spectre' chip flaw,https://www.japantimes.co.jp/news/2018/01/05/business/tech/apple-issue-fix-iphones-macs-risk-spectre-chip-flaw/
"Jan 4, 2018","Security flaws affecting chips from Intel, AMD and ARM could put virtually all phones and computers at risk",https://www.japantimes.co.jp/news/2018/01/04/business/tech/security-flaws-affecting-chips-intel-amd-arm-put-virtually-phones-computers-risk/
"Jan 3, 2018",Alibaba affiliate forced to drop attempt to buy U.S. remittance firm MoneyGram,https://www.japantimes.co.jp/news/2018/01/03/business/tech/alibaba-affiliate-forced-drop-attempt-buy-u-s-remittance-firm-moneygram/
"Jan 2, 2018",North Korean hackers seen hijacking computers to mine digital currencies as sanctions kick in,https://www.japantimes.co.jp/news/2018/01/02/business/tech/north-korean-hackers-seen-hijacking-computers-mine-digital-currencies-sanctions-kick/
"Dec 29, 2017",Oton Glass CEO looks to help those with reading disabilities and ease their lives,https://www.japantimes.co.jp/news/2017/12/29/business/tech/oton-glass-ceo-hopes-reading-disabilities-will-help-ease-lives/
"Dec 29, 2017",Apple apologizes for secretly slowing older iPhones,https://www.japantimes.co.jp/news/2017/12/29/business/tech/apple-apologizes-secretly-slowing-older-iphones/
"Dec 29, 2017",France targets Apple and Epson with possibly landmark legal action over planned obsolescence,https://www.japantimes.co.jp/news/2017/12/29/business/tech/france-targets-apple-epson-possibly-landmark-legal-action-planned-obsolescence/
"Dec 26, 2017","Uber's loss in Europe shows trans-Atlantic split over disruptive tech, could embolden U.S. cities to act",https://www.japantimes.co.jp/news/2017/12/26/business/tech/ubers-loss-europe-shows-trans-atlantic-split-disruptive-tech-embolden-u-s-cities-act/
