Date,Title,Url
"Aug 5, 2018",Ding! Alibaba office app fuels backlash among some Chinese workers,https://www.japantimes.co.jp/news/2018/08/05/business/tech/ding-alibaba-office-app-fuels-backlash-among-chinese-workers/
"Aug 5, 2018",Are tech titans teetering atop the market?,https://www.japantimes.co.jp/news/2018/08/05/business/tech/tech-titans-teetering-atop-market/
"Aug 2, 2018",Congress passes bill forcing tech firms to disclose foreign access to software sold to U.S. military,https://www.japantimes.co.jp/news/2018/08/02/business/tech/congress-passes-bill-forcing-tech-firms-disclose-foreign-access-software-sold-u-s-military/
"Aug 2, 2018","Bowing to censorship, Google plans to launch search app in lucrative Chinese market, ending long boycott: sources",https://www.japantimes.co.jp/news/2018/08/02/business/tech/bowing-censorship-google-plans-launch-search-app-lucrative-chinese-market-ending-long-boycott-sources/
"Aug 1, 2018",Japan Display plans foray into consumer markets with smart motorcycle helmets and mirrors,https://www.japantimes.co.jp/news/2018/08/01/business/tech/japan-display-plans-foray-consumer-markets-smart-motorcycle-helmets-mirrors/
"Jul 31, 2018",19-year-old CEO creates app to bring Japan's voters and politicians together,https://www.japantimes.co.jp/news/2018/07/31/business/tech/19-year-old-ceo-creates-app-bring-japans-voters-politicians-together/
"Jul 31, 2018",Nokia to help with T-Mobile superfast 5G telecom network in $3.5 billion deal,https://www.japantimes.co.jp/news/2018/07/31/business/tech/nokia-help-t-mobile-superfast-5g-telecom-network-3-5-billion-deal/
"Jul 29, 2018",Art museums fight Facebook over nudity,https://www.japantimes.co.jp/news/2018/07/29/business/tech/rubens-vs-facebook-fight-artistic-nudity/
"Jul 29, 2018",Apple and Amazon lead the race toward $1 trillion market value,https://www.japantimes.co.jp/news/2018/07/29/business/tech/apple-amazon-lead-pack-1-trillion-market-value/
"Jul 28, 2018","YouTube plans original programming in Japan, India and other markets",https://www.japantimes.co.jp/news/2018/07/28/business/tech/youtube-plans-original-programming-japan-india-markets/
"Jul 19, 2018",Sony starts taking advance orders for new version of Aibo robot dog,https://www.japantimes.co.jp/news/2018/07/19/business/tech/sony-starts-taking-preorders-new-version-aibo-robot-dog/
"Jul 19, 2018","In fining Google, EU is fighting the past",https://www.japantimes.co.jp/news/2018/07/19/business/tech/fining-google-eu-fighting-past/
"Jul 19, 2018",Google shrugs off EU fine; damage to hinge on rivals' next moves,https://www.japantimes.co.jp/news/2018/07/19/business/tech/google-shrugs-off-eu-fine-damage-hinge-rivals-next-moves/
"Jul 19, 2018",Plane makers working on tech to cut cockpit crews to one but facing pilot pushback,https://www.japantimes.co.jp/news/2018/07/19/business/tech/plane-makers-working-tech-cut-cockpit-crews-one-facing-pilot-pushback/
"Jul 18, 2018","ZMP, Hinomaru Kotsu to test driverless taxis on Tokyo roads in August with eye to 2020 launch",https://www.japantimes.co.jp/news/2018/07/18/business/tech/autonomous-taxi-tests-start-tokyo-view-launch-service-2020/
"Jul 17, 2018",Communist-run Cuba starts rolling out internet on mobile phones,https://www.japantimes.co.jp/news/2018/07/17/business/tech/communist-run-cuba-starts-rolling-internet-mobile-phones/
"Jul 15, 2018",Fake news and the role of algorithms in today's world,https://www.japantimes.co.jp/news/2018/07/15/business/tech/fake-news-role-algorithms-todays-world/
"Jul 11, 2018",Britain to fine Facebook over data breach,https://www.japantimes.co.jp/news/2018/07/11/business/tech/britain-fine-facebook-data-breach/
"Jul 6, 2018",Tokyo blockchain conference looks to uses of technology beyond headline-grabbing cryptocurrencies,https://www.japantimes.co.jp/news/2018/07/06/business/tech/tokyo-blockchain-conference-looks-uses-technology-beyond-headline-grabbing-cryptocurrencies/
"Jul 6, 2018",Elon Musk's team talking with Thai officials on using tech for cave rescue,https://www.japantimes.co.jp/news/2018/07/06/business/tech/elon-musks-team-talking-thai-officials-using-tech-cave-rescue/
"Jul 5, 2018",New Tokyo research center aims to boost Japan's 'Fourth Industrial Revolution',https://www.japantimes.co.jp/news/2018/07/05/business/tech/new-tokyo-research-center-aims-boost-japans-fourth-industrial-revolution/
"Jul 5, 2018",China's push to end reliance on U.S. technology at center of nations' trade fight,https://www.japantimes.co.jp/news/2018/07/05/business/tech/chinas-push-end-reliance-u-s-technology-center-nations-trade-fight/
"Jul 4, 2018","Kangaroo-like transforming robot, created by Chiba university, keen to carry your groceries",https://www.japantimes.co.jp/news/2018/07/04/business/tech/kangaroo-like-transforming-robot-created-chiba-university-keen-carry-groceries/
"Jul 2, 2018",Japanese government to give flying cars a jump-start,https://www.japantimes.co.jp/news/2018/07/02/business/tech/japanese-government-give-flying-cars-jump-start/
"Jun 29, 2018",U.S. startups involved in 'critical' technologies at risk from Chinese influence,https://www.japantimes.co.jp/news/2018/06/29/business/tech/u-s-startups-involved-critical-technologies-risk-chinese-influence/
"Jun 27, 2018","Facebook, Google 'manipulate' users to share data despite EU law: study",https://www.japantimes.co.jp/news/2018/06/27/business/tech/facebook-google-manipulate-users-share-data-despite-eu-law-study/
"Jun 26, 2018",Vaio to be first in nation to screen VR movies in a theater,https://www.japantimes.co.jp/news/2018/06/26/business/tech/vaio-first-nation-screen-vr-movies-theater/
"Jun 22, 2018",Tech firms may have to filter user uploads under new EU rules,https://www.japantimes.co.jp/news/2018/06/22/business/tech/tech-firms-may-filter-user-uploads-new-eu-rules/
"Jun 20, 2018",Silicon Valley-style coding boot camp seeks to reset Japan Inc.,https://www.japantimes.co.jp/news/2018/06/20/business/tech/silicon-valley-style-coding-boot-camp-seeks-reset-japan-inc/
"Jun 19, 2018","Norway tests small electric plane, sees passenger flights by 2025 if shift to green tech grows",https://www.japantimes.co.jp/news/2018/06/19/business/tech/norway-tests-small-electric-plane-sees-passenger-flights-2025-shift-green-tech-grows/
"Jun 14, 2018",Apple steps up encryption to thwart unauthorized police cracking of iPhones,https://www.japantimes.co.jp/news/2018/06/14/business/tech/apple-steps-encryption-thwart-unauthorized-police-cracking-iphones/
"Jun 13, 2018",Cloud play on the horizon in changing video game world as companies tout new technologies at E3 expo,https://www.japantimes.co.jp/news/2018/06/13/business/tech/cloud-play-horizon-changing-video-game-world-companies-tout-new-technologies-e3-expo/
"Jun 11, 2018",Sharp to launch smart toilet for cats that can identify health problems,https://www.japantimes.co.jp/news/2018/06/11/business/tech/sharp-launch-smart-cat-toilet-can-identify-health-problems/
"Jun 8, 2018","Google bars uses of its artificial intelligence tech in weapons, unreasonable surveillance",https://www.japantimes.co.jp/news/2018/06/08/business/tech/google-bars-uses-artificial-intelligence-tech-weapons-unreasonable-surveillance/
"Jun 7, 2018","YouTube is partly liable for copyright breaches, Austrian court rules",https://www.japantimes.co.jp/news/2018/06/07/business/tech/youtube-partly-liable-copyright-breaches-austrian-court-rules/
"Jun 7, 2018",Flying-car startup backed by Google co-founder offers test flights,https://www.japantimes.co.jp/news/2018/06/07/business/tech/flying-car-startup-backed-google-founder-offers-test-flights/
"Jun 6, 2018","Facebook confirms it shared data with Chinese companies Huawei, Lenovo, OPPO and TCL",https://www.japantimes.co.jp/news/2018/06/06/business/tech/facebook-confirms-shared-data-chinese-companies-huawei-lenovo-oppo-tcl/
"Jun 5, 2018",Apple dangling more goodies while tackling technology addiction,https://www.japantimes.co.jp/news/2018/06/05/business/tech/apple-dangling-goodies-adding-tech-diet-options/
"Jun 4, 2018",Japan aims to launch self-driving vehicle services by 2020,https://www.japantimes.co.jp/news/2018/06/04/business/tech/japan-aims-launch-self-driving-vehicle-services-2020/
"Jun 2, 2018",Google retreating from military AI project after 'rebellion' by company workers: reports,https://www.japantimes.co.jp/news/2018/06/02/business/tech/google-retreating-military-ai-project-rebellion-company-workers-reports/
"Jun 2, 2018","Apple set to debut phone-to-phone augmented reality, sources say",https://www.japantimes.co.jp/news/2018/06/02/business/tech/apple-set-debut-phone-phone-augmented-reality-sources-say/
"May 31, 2018",Amazon blocks Australia from global sites over new tax,https://www.japantimes.co.jp/news/2018/05/31/business/tech/amazon-blocks-australia-global-sites-new-tax/
"May 30, 2018",Nintendo unveils Pokemon titles and 'Poke Ball' Switch controller aimed at unifying gaming experience,https://www.japantimes.co.jp/news/2018/05/30/business/tech/nintendo-unveils-pokemon-titles-poke-ball-switch-controller-aimed-unifying-gaming-experience/
"May 26, 2018",FBI warns Russians hacked hundreds of thousands of routers,https://www.japantimes.co.jp/news/2018/05/26/business/tech/fbi-warns-russians-hacked-hundreds-thousands-routers/
"May 26, 2018",Tesla agrees to settle class action over Autopilot system that was billed as 'safer',https://www.japantimes.co.jp/news/2018/05/26/business/tech/tesla-agrees-settle-class-action-autopilot-system-billed-safer/
"May 25, 2018","Smartphones now the preferred choice for internet access in Japan, surpassing PCs for first time",https://www.japantimes.co.jp/news/2018/05/25/business/tech/smartphones-now-preferred-choice-internet-access-japan-surpassing-pcs-first-time/
"May 25, 2018","Amazon Echo eavesdropped on couple, sent recording to a contact: report",https://www.japantimes.co.jp/news/2018/05/25/business/tech/amazon-echo-eavesdropped-couple-sent-recording-contact-report/
"May 21, 2018","Orbital freighter bringing cement, extreme cold experiments and food to ISS",https://www.japantimes.co.jp/news/2018/05/21/business/tech/orbital-freighter-set-carry-cement-extreme-cold-experiments-food-iss/
"May 20, 2018",Drone deliveries ready to soar in Japan but lingering issues likely to keep post office in business,https://www.japantimes.co.jp/news/2018/05/20/business/tech/drone-deliveries-ready-soar-japan-lingering-issues-likely-keep-post-office-business/
"May 20, 2018",Pilot schools cash in as drone business takes off in Japan,https://www.japantimes.co.jp/news/2018/05/20/business/tech/pilot-schools-cash-drone-business-takes-off-japan/
"May 20, 2018","From office watcher to farm protector and crop duster, unmanned aircraft playing unusual roles",https://www.japantimes.co.jp/news/2018/05/20/business/tech/office-watcher-farm-protector-crop-duster-unmanned-aircraft-playing-unusual-roles/
"May 18, 2018",YouTube to launch music streaming service on May 22,https://www.japantimes.co.jp/news/2018/05/18/business/tech/youtube-launch-music-streaming-service-may-22/
"May 17, 2018",Student's idea for app that pulls up athlete profiles on demand gets nod from Tokyo organizers,https://www.japantimes.co.jp/news/2018/05/17/business/tech/students-idea-app-pulls-athlete-profiles-demand-gets-nod-tokyo-organizers/
"May 12, 2018",SoftBank-owned Boston Dynamics prepares to unleash its dog-like robot,https://www.japantimes.co.jp/news/2018/05/12/business/tech/softbank-owned-robot-maker-prepares-unleash-dog-like-machine/
"May 10, 2018","Self-navigating AI learns to take shortcuts, outperforms human expert: study",https://www.japantimes.co.jp/news/2018/05/10/business/tech/self-navigating-ai-learns-take-shortcuts-outperforms-human-expert-study/
"May 7, 2018",Sales of Sony's new Aibo robot dog off to solid start,https://www.japantimes.co.jp/news/2018/05/07/business/tech/sales-sonys-new-aibo-robot-dog-off-solid-start/
"May 1, 2018","Paper plane protesters urge Russia to unblock Telegram app, which Iran also banned",https://www.japantimes.co.jp/news/2018/05/01/business/tech/paper-plane-protesters-urge-russia-unblock-telegram-app-iran-also-banned/
"Apr 27, 2018",IBM ties up with Asahi Refining and others on blockchain tech to track jewels from mine to store,https://www.japantimes.co.jp/news/2018/04/27/business/tech/ibm-ties-asahi-refining-others-blockchain-tech-track-jewels-mine-store/
"Apr 26, 2018",SoftBank-led trio develop robot that can transform into car,https://www.japantimes.co.jp/news/2018/04/26/business/tech/softbank-unit-others-develop-humanoid-robot-can-transform-electric-car/
"Apr 25, 2018",Dragon Quest VR arcade to open in Shinjuku,https://www.japantimes.co.jp/news/2018/04/25/business/tech/dragon-quest-vr-arcade-open-shinjuku/
"Apr 25, 2018",U.S. commerce secretary: China 2025 plan to be tech nexus 'frightening',https://www.japantimes.co.jp/news/2018/04/25/business/tech/u-s-commerce-secretary-china-2025-plan-tech-nexus-frightening/
"Apr 24, 2018",Yamato and DeNA test autonomous delivery system in Japan,https://www.japantimes.co.jp/news/2018/04/24/business/tech/yamato-dena-test-autonomous-delivery-system-japan/
"Apr 24, 2018",Amazon reportedly working on another big bet: home robots,https://www.japantimes.co.jp/news/2018/04/24/business/tech/amazon-reportedly-working-another-big-bet-home-robots/
"Apr 23, 2018","Construction robots in Japan weld, bolt and lift to tackle worker shortage",https://www.japantimes.co.jp/news/2018/04/23/business/tech/construction-robots-japan-weld-bolt-lift-tackle-worker-shortage/
"Apr 23, 2018",Chinese cyberspies allegedly targeted Japanese defense firms for North Korea secrets: report,https://www.japantimes.co.jp/news/2018/04/23/business/tech/china-cyberspies-believed-targeted-japanese-defense-firms-north-korea-secrets/
"Apr 22, 2018",Surge in anonymous Asia Twitter accounts sparks bot fears,https://www.japantimes.co.jp/news/2018/04/22/business/tech/surge-anonymous-asia-twitter-accounts-sparks-bot-fears/
"Apr 20, 2018",Nintendo's $30 billion rally now depends on $70 cardboard pianos,https://www.japantimes.co.jp/news/2018/04/20/business/tech/nintendos-30-billion-rally-now-depends-70-cardboard-pianos/
"Apr 20, 2018",Cafes offer students 'virtual' workday experiences,https://www.japantimes.co.jp/news/2018/04/20/business/tech/cafes-offer-students-virtual-workday-experiences/
"Apr 18, 2018",Over 100 parts for NASA's Orion deep-space capsule to be 3-D-printed,https://www.japantimes.co.jp/news/2018/04/18/business/tech/100-parts-nasas-orion-deep-space-capsule-3-d-printed/
"Apr 17, 2018","In race for 5G, China leads South Korea and U.S., study shows",https://www.japantimes.co.jp/news/2018/04/17/business/tech/race-5g-china-leads-south-korea-u-s-study/
"Apr 17, 2018",Toyota to launch 'talking' vehicles in U.S. in 2021,https://www.japantimes.co.jp/news/2018/04/17/business/tech/toyota-launch-talking-vehicles-united-states-2021/
"Apr 17, 2018","U.S. and Britain warn of Russian campaign to hack networks, control data flows",https://www.japantimes.co.jp/news/2018/04/17/business/tech/u-s-britain-warn-russian-campaign-hack-networks-control-data-flows/
"Apr 13, 2018",NTSB boots Tesla from probe into fatal California SUV crash after firm reveals information early,https://www.japantimes.co.jp/news/2018/04/13/business/tech/feds-boot-tesla-probe-fatal-california-suv-crash-firm-reveals-info-early/
"Apr 13, 2018",Nintendo teams up with venture fund to find new tech for Switch,https://www.japantimes.co.jp/news/2018/04/13/business/tech/nintendo-teams-venture-fund-find-new-tech-switch/
"Apr 11, 2018",Zuckerberg deflects senators' efforts on regulating Facebook or changing how it does business,https://www.japantimes.co.jp/news/2018/04/11/business/tech/zuckerberg-deflects-senators-efforts-regulating-facebook-changing-business/
"Apr 11, 2018",Zuckerberg's internal notes advised him to cite Chinese competition if Senators suggested breaking up Facebook,https://www.japantimes.co.jp/news/2018/04/11/business/tech/zuckerbergs-internal-notes-advised-cite-chinese-competition-senators-suggested-breaking-facebook/
"Apr 9, 2018","In shadow of looming China-U.S. trade war, rivals waging high-stakes quantum computing battle",https://www.japantimes.co.jp/news/2018/04/09/business/tech/china-u-s-vying-winner-race-develop-quantum-computing/
"Apr 4, 2018",NASA taps Lockheed Martin to build supersonic plane that won't go boom,https://www.japantimes.co.jp/news/2018/04/04/business/tech/nasa-taps-lockheed-martin-build-supersonic-plane-wont-go-boom/
"Apr 2, 2018","Hackers breach Saks, Lord & Taylor customer data, parent Hudson's Bay says",https://www.japantimes.co.jp/news/2018/04/02/business/tech/hackers-breach-saks-lord-taylor-customer-data-parent-hudsons-bay-says/
"Apr 1, 2018",Confirmed or suspected cyberthefts of personal info in Japan exceeded 3 million cases in 2017: tally,https://www.japantimes.co.jp/news/2018/04/01/business/tech/3-million-cases-personal-info-leaked-due-cyberattacks-2017/
"Apr 1, 2018","With paper and phones, Atlanta struggles to recover from cyberattack",https://www.japantimes.co.jp/news/2018/04/01/business/tech/paper-phones-atlanta-struggles-recover-cyberattack/
"Mar 31, 2018","Russian accused of massive hacking extradited to U.S., pleads guilty",https://www.japantimes.co.jp/news/2018/03/31/business/tech/russian-accused-massive-hacking-extradited-u-s-pleads-guilty/
"Mar 30, 2018","Is 'No Postage Necessary,' Hollywood's first blockchain movie, the first step toward ending piracy?",https://www.japantimes.co.jp/news/2018/03/30/business/tech/no-postage-necessary-hollywoods-first-blockchain-movie-first-step-toward-ending-piracy/
"Mar 30, 2018",Windows group chief out as Microsoft shakes up ranks to shoot for the cloud,https://www.japantimes.co.jp/news/2018/03/30/business/tech/windows-group-chief-microsoft-shakes-ranks-shoot-cloud/
"Mar 29, 2018",Facebook cuts ties to data brokers in blow to targeted ads,https://www.japantimes.co.jp/news/2018/03/29/business/tech/facebook-cuts-ties-data-brokers-blow-targeted-ads/
"Mar 28, 2018",Apple takes on Google in education with cheaper iPad and new software,https://www.japantimes.co.jp/news/2018/03/28/business/tech/apple-takes-google-education-cheaper-ipad-new-software/
"Mar 28, 2018",Is Mark Zuckerberg willing to act boldly to fix Facebook crisis?,https://www.japantimes.co.jp/news/2018/03/28/business/tech/mark-zuckerberg-willing-act-boldly-fix-facebook-crisis/
"Mar 28, 2018",Lyft co-founder: Fatal crash of autonomous Uber taxi should have been prevented,https://www.japantimes.co.jp/news/2018/03/28/business/tech/lyft-co-founder-fatal-crash-autonomous-uber-taxi-prevented/
"Mar 27, 2018","What's for dinner? On redesigned Ajinomoto recipe website, AI makes the call",https://www.japantimes.co.jp/news/2018/03/27/business/tech/whats-dinner-redesigned-ajinomoto-recipe-website-ai-makes-call/
"Mar 24, 2018",Delete Facebook? Protecting privacy is harder than that,https://www.japantimes.co.jp/news/2018/03/24/business/tech/delete-facebook-protecting-privacy-harder/
"Mar 24, 2018",Facebook crisis prompts Silicon Valley soul-searching,https://www.japantimes.co.jp/news/2018/03/24/business/tech/facebook-crisis-prompts-silicon-valley-soul-searching/
"Mar 22, 2018",U.S. Senate passes bill to penalize websites for sex-trafficking,https://www.japantimes.co.jp/news/2018/03/22/business/tech/u-s-senate-passes-bill-penalize-websites-sex-trafficking/
"Mar 22, 2018",U.S. spending bill includes bid to solve international email privacy impasse,https://www.japantimes.co.jp/news/2018/03/22/business/tech/u-s-spending-bill-includes-bid-solve-international-email-privacy-impasse/
"Mar 22, 2018",Facebook warned in 2011 of user data loopholes exploited by Cambridge Analytica: privacy campaigner,https://www.japantimes.co.jp/news/2018/03/22/business/tech/facebook-warned-2011-user-data-loopholes-exploited-cambridge-analytica-privacy-campaigner/
"Mar 21, 2018",Toyota halts robot-car tests in wake of crash in Arizona,https://www.japantimes.co.jp/news/2018/03/21/business/tech/toyota-halts-robot-car-tests-wake-crash-arizona/
"Mar 21, 2018",Singapore-based NEM foundation ends tracking of stolen cryptocurrency,https://www.japantimes.co.jp/news/2018/03/21/business/tech/singapore-based-nem-foundation-ends-tracking-stolen-cryptocurrency/
"Mar 20, 2018","Female pedestrian dies in Arizona after being hit by Uber self-driving SUV, prompting halt in tests",https://www.japantimes.co.jp/news/2018/03/20/business/tech/female-pedestrian-dies-arizona-hit-uber-self-driving-suv-prompting-halt-tests/
"Mar 19, 2018",Apple's 'secret' project: Replacing Samsung screens with in-house microLED displays,https://www.japantimes.co.jp/news/2018/03/19/business/tech/apples-secret-project-replacing-samsung-screens-house-microled-displays/
"Mar 19, 2018",Driverless drift: Robotics firms are developing virtual 'Fast and Furious'-style simulations to boost safety,https://www.japantimes.co.jp/news/2018/03/19/business/tech/driverless-drift-robotics-firms-developing-virtual-fast-furious-style-simulations-boost-safety/
"Mar 14, 2018",YouTube to display Wikipedia blurbs alongside conspiracy videos,https://www.japantimes.co.jp/news/2018/03/14/business/tech/youtube-display-wikipedia-blurbs-alongside-conspiracy-videos/
"Mar 14, 2018",Researchers find 'critical' security flaws in AMD chips,https://www.japantimes.co.jp/news/2018/03/14/business/tech/researchers-find-critical-security-flaws-amd-chips/
"Mar 9, 2018",Olympics hack highlights emerging 'false flags' threat: researcher,https://www.japantimes.co.jp/news/2018/03/09/business/tech/olympics-hack-highlights-emerging-false-flags-threat-researcher/
"Mar 5, 2018",Google expansion plans seen turning Big Apple into Silicon Valley East,https://www.japantimes.co.jp/news/2018/03/05/business/tech/google-expansion-plans-seen-turning-big-apple-silicon-valley-east/
"Mar 4, 2018","Africa, IT hub: Cameroonian startup launches drones for global market",https://www.japantimes.co.jp/news/2018/03/04/business/tech/africa-hub-cameroonian-startup-launches-drones-global-market/
"Mar 2, 2018",New U.S. satellite to boost weather forecasts sent into space,https://www.japantimes.co.jp/news/2018/03/02/business/tech/new-u-s-satellite-boost-weather-forecasts-sent-space/
"Mar 1, 2018",Japanese scientists invent 'firefly' light that floats on ultrasonic waves,https://www.japantimes.co.jp/news/2018/03/01/business/tech/japanese-scientists-invent-firefly-light-floats-ultrasonic-waves/
"Feb 28, 2018",How Samsung's new Galaxy S9 compares to the iPhone X,https://www.japantimes.co.jp/news/2018/02/28/business/tech/samsungs-new-galaxy-s9-compares-iphone-x/
"Feb 28, 2018",Ford to use Miami-Dade as test bed for self-driving cars,https://www.japantimes.co.jp/news/2018/02/28/business/tech/ford-use-miami-dade-test-bed-self-driving-cars/
"Feb 25, 2018",Japan's budget for AI to be less than a fifth of that planned by U.S. and China,https://www.japantimes.co.jp/news/2018/02/25/business/tech/japanese-government-spending-ai-less-20-u-s-china/
"Feb 25, 2018",Pioneering nonprofit aims to steer AI toward the greater good,https://www.japantimes.co.jp/news/2018/02/25/business/tech/pioneering-nonprofit-aims-steer-ai-toward-greater-good/
"Feb 25, 2018","Apple moves to store iCloud keys in China, raising rights concerns",https://www.japantimes.co.jp/news/2018/02/25/business/tech/apple-moves-store-icloud-keys-china-raising-rights-concerns/
"Feb 22, 2018",New Japan travel app pairs Microsoft's AI chatbot with Navitime guidance,https://www.japantimes.co.jp/news/2018/02/22/business/tech/new-japan-travel-app-pairs-microsofts-ai-chatbot-navitime-guidance/
"Feb 22, 2018",Twitter cracks down on tactics used by 'bots' to spread false stories,https://www.japantimes.co.jp/news/2018/02/22/business/tech/twitter-cracks-tactics-used-bots-spread-false-stories/
"Feb 18, 2018",Online retailer Amazon may be turning to health care,https://www.japantimes.co.jp/news/2018/02/18/business/tech/amazon-ambitions-seem-boundless-online-retailer-turns-health-care/
"Feb 16, 2018",Mitsubishi Electric shines spotlight on new AI technology at R&D event,https://www.japantimes.co.jp/news/2018/02/16/business/tech/mitsubishi-electric-shines-spotlight-new-ai-technology-rd-event/
"Feb 16, 2018",White House joins U.K. in blaming Russia for 'reckless' NotPetya cyberattack,https://www.japantimes.co.jp/news/2018/02/16/business/tech/white-house-joins-u-k-blaming-russia-reckless-notpetya-cyberattack/
"Feb 13, 2018",5G is here: Super speed makes worldwide debut at Winter Olympics,https://www.japantimes.co.jp/news/2018/02/13/business/tech/5g-super-speed-makes-worldwide-debut-winter-olympics/
"Feb 11, 2018","Esports finally arrives in Japan, home of game giants like Nintendo and Sony",https://www.japantimes.co.jp/news/2018/02/11/business/tech/esports-finally-arrives-japan-home-game-giants-like-nintendo-sony/
"Feb 7, 2018",Uber says hackers behind 2016 data breach were in Canada and Florida,https://www.japantimes.co.jp/news/2018/02/07/business/tech/uber-says-hackers-behind-2016-data-breach-canada-florida/
"Feb 6, 2018",North Korean hackers said possibly behind massive Coincheck heist,https://www.japantimes.co.jp/news/2018/02/06/business/tech/north-korean-hackers-said-possibly-behind-massive-coincheck-heist/
"Feb 6, 2018",Court hears denial after Waymo accuses Uber of 'cheating' by stealing its self-driving car secrets,https://www.japantimes.co.jp/news/2018/02/06/business/tech/trial-hears-denial-waymo-accuses-uber-cheating-stealing-self-driving-car-secrets/
"Feb 5, 2018",South Korea says North stole cryptocurrency worth billions of won last year,https://www.japantimes.co.jp/news/2018/02/05/business/tech/south-korea-says-north-stole-cryptocurrency-worth-billions-won-last-year/
"Jan 31, 2018",Facebook bans ads tied to bitcoin and other cryptocurrencies,https://www.japantimes.co.jp/news/2018/01/31/business/tech/facebook-bans-ads-tied-bitcoin-cryptocurrencies/
